{
  "campaign_id": "p4-live-reference-build-campaign",
  "target_id": "claude-code",
  "role": "target",
  "runtime": "claude-code",
  "model": "claude-opus-5",
  "fixture_id": "premium-marketing-site",
  "campaign_base_commit": "3ccdf6e6209c3aea949e62226af1cb6b35167487",
  "run_branch": "bench/p4-asteria-claude-code",
  "fixture_sha256": "e57da062e6223f6ecbea84a64813f6d8e73f9b0954cda065da5edbc680762947",
  "rubric_sha256": "6463ae7fde36affecc20eff21f0ec73e04e0fb44c920a3cbc9115502a1b56b31",
  "started_at": "2026-08-13T19:39:43Z",
  "tool_permissions": [
    "filesystem-read-write",
    "shell",
    "git-push-run-branch-only",
    "network-egress-allowlisted",
    "npm-registry",
    "chromium-playwright"
  ],
  "isolation_attestation": {
    "same_base_commit": true,
    "no_cross_run_branch_reads": true,
    "no_implementation_reuse": true
  },
  "notes": "Model string reported by the runtime in-session: claude-opus-5. Run branch head at start equals campaign base commit 3ccdf6e (merge of P4 campaign infrastructure), which is an ancestor of origin/main. No bench/p4-asteria-calibration-gpt-5-6-sol or bench/p4-asteria-codex content was read, diffed, or reused; no repository history search for a prior Asteria implementation was performed. Network egress is allowlisted: only the npm registry and github.com are reachable. api.vercel.com, api.netlify.com, api.cloudflare.com and tunnel providers (trycloudflare.com, loca.lt, srv.us) are unreachable from this environment, so no public production domain could be provisioned; see evidence/production/deployment-constraint.md."
}
