{
  "campaign_id": "p4-live-reference-build-campaign",
  "target_id": "codex",
  "role": "target",
  "runtime": "codex",
  "model": "GPT-5",
  "fixture_id": "premium-marketing-site",
  "campaign_base_commit": "3ccdf6e6209c3aea949e62226af1cb6b35167487",
  "run_branch": "bench/p4-asteria-codex",
  "fixture_sha256": "e57da062e6223f6ecbea84a64813f6d8e73f9b0954cda065da5edbc680762947",
  "rubric_sha256": "6463ae7fde36affecc20eff21f0ec73e04e0fb44c920a3cbc9115502a1b56b31",
  "started_at": "2026-08-13T16:31:00-03:00",
  "tool_permissions": [
    "filesystem: workspace-write under /workspace/scratch/b9c5e270056f",
    "network: restricted allowlist",
    "GitHub connector: available",
    "GitHub CLI: unavailable",
    "local browser automation: available",
    "image generation: available",
    "Sites checkout/deployment: blocked because /workspace/sites is outside writable roots"
  ],
  "isolation_attestation": {
    "same_base_commit": true,
    "no_cross_run_branch_reads": true,
    "no_implementation_reuse": true
  },
  "notes": "Codex self-identifies in this session as an agent based on GPT-5; model is recorded exactly as GPT-5. The run did not inspect, fetch, diff, or reuse any other Asteria target branch or repository history."
}
